0,ny right disconnect uk
8,support forced labour illiteracy
9,residents suffering officials blame
10,protect intellectual property rights
11,use hedge losses cnbc
12,slip rhetoric escalates washington
14,businesses sir martin sorrell
16,brazil ibovespa falls electoral
17,infiltrated cia diplomatic threats
18,facebook thewalkingdead emini spy
0,buy semiconductors help surplus
3,entrepreneur success startup please
6,singapore growth favorite despite
7,throws curveball meeting kim
9,nobel prize winner economics
12,pessimism wild optimism european
13,saudi tell catastrophic yemen
15,gears gb xbox gb
16,nifty sensex slips pts
18,vxo vix blue line
0,level field costly biotech
1,ongoing worldwide including nafta
2,hike forecast disappointment sink
3,agri pharma issues shadow
4,cannabis opportunity way correct
5,precedent trigger domino effect
8,drums oil takes hawk
9,action aluminum steel drawing
13,outlook prospects heavy rural
16,thai tourism looking looms